{
  "schema_version": "udh.changes/1",
  "change_set_id": "changes-demo",
  "session_id": "session-demo",
  "task_id": "task-1",
  "permit_id": "permit-demo",
  "preimage_digest": "sha256:aaaaaaaaaaaaaaaaaaaaaaaaaaaaaaaaaaaaaaaaaaaaaaaaaaaaaaaaaaaaaaaa",
  "postimage_digest": "sha256:bbbbbbbbbbbbbbbbbbbbbbbbbbbbbbbbbbbbbbbbbbbbbbbbbbbbbbbbbbbbbbbb",
  "changes": [
    {
      "path": "src/parser.py",
      "operation": "modify",
      "before_digest": "sha256:aaaaaaaaaaaaaaaaaaaaaaaaaaaaaaaaaaaaaaaaaaaaaaaaaaaaaaaaaaaaaaaa",
      "after_digest": "sha256:bbbbbbbbbbbbbbbbbbbbbbbbbbbbbbbbbbbbbbbbbbbbbbbbbbbbbbbbbbbbbbbb",
      "artifact_id": "artifact-demo"
    }
  ],
  "unexpected_paths": [],
  "runner_id": "fixture-runner",
  "observed_at": "2026-09-15T07:00:00Z",
  "apply_status": "not_applied"
}
